{
  "as_of": "2026-10-01T00:00:00.000Z",
  "as_of_digest": "sha256:ecc39db8dd4a11ba246b8d6072f6b830657437969b82b6b2e9da49c24decd5ed",
  "chain": {
    "as_of": "unknown",
    "latest": "ok_with_caveats"
  },
  "complete": true,
  "control": null,
  "drift": [
    {
      "ctx_id": "acdp://registry.example.com/aaaaaaaa-aaaa-4aaa-8aaa-aaaaaaaaaaaa",
      "kind": "verdict_changed"
    }
  ],
  "evidence_digest": "sha256:896987638654aab19e8d49ad231a01e5ed0496576ab86007963ad195cfc51b97",
  "frontier": [],
  "horizon": "2026-09-30T00:00:00.000Z",
  "limits": {
    "max_depth": 10,
    "max_fanout": 100,
    "max_nodes": 500
  },
  "nodes": [
    {
      "as_of": {
        "caveats": [
          "observed_basis"
        ],
        "stages": {
          "content_hash": {
            "basis": "self",
            "value": "ok"
          },
          "identity": {
            "basis": "registry",
            "value": "ok"
          },
          "key": {
            "basis": "self",
            "value": "current"
          },
          "key_revocation": {
            "basis": "observed",
            "evidence_time": "2026-09-30T00:00:00.000Z",
            "value": "not-revoked"
          },
          "log": {
            "value": "absent"
          },
          "presence": {
            "basis": "registry",
            "evidence_time": "2026-08-15T00:00:00.000Z",
            "value": "present"
          },
          "registry_receipt": {
            "basis": "registry",
            "evidence_time": "2026-08-15T00:00:00.000Z",
            "key_status": "current",
            "value": "ok"
          },
          "retraction": {
            "events_admitted": 0,
            "value": "unknown"
          },
          "signature": {
            "basis": "self",
            "value": "ok"
          }
        },
        "verdict": "unknown"
      },
      "ctx_id": "acdp://registry.example.com/aaaaaaaa-aaaa-4aaa-8aaa-aaaaaaaaaaaa",
      "depth": 0,
      "derived_from": [],
      "latest": {
        "caveats": [
          "observed_basis"
        ],
        "stages": {
          "content_hash": {
            "basis": "self",
            "value": "ok"
          },
          "identity": {
            "basis": "registry",
            "value": "ok"
          },
          "key": {
            "basis": "self",
            "value": "current"
          },
          "key_revocation": {
            "basis": "observed",
            "evidence_time": "2026-09-30T00:00:00.000Z",
            "value": "not-revoked"
          },
          "log": {
            "value": "absent"
          },
          "presence": {
            "basis": "registry",
            "evidence_time": "2026-08-15T00:00:00.000Z",
            "value": "present"
          },
          "registry_receipt": {
            "basis": "registry",
            "evidence_time": "2026-08-15T00:00:00.000Z",
            "key_status": "current",
            "value": "ok"
          },
          "retraction": {
            "basis": "observed",
            "events_admitted": 2,
            "evidence_time": "2026-09-02T00:00:01.000Z",
            "value": "not_retracted"
          },
          "signature": {
            "basis": "self",
            "value": "ok"
          }
        },
        "verdict": "ok_with_caveats"
      }
    }
  ],
  "options_digest": null,
  "require_attested_events": true,
  "roots": [
    "acdp://registry.example.com/aaaaaaaa-aaaa-4aaa-8aaa-aaaaaaaaaaaa"
  ],
  "tainted_paths": {
    "as_of": [],
    "latest": []
  },
  "verdict_digest": "sha256:93ea4f6c4fc1de0839f4a513fb6fee1af7423dd3de1fcda1eab3537373f73621",
  "verdict_version": "acdp-chain-verdict/1"
}
