{
  "as_of": "2026-10-01T00:00:00.000Z",
  "as_of_digest": "sha256:1bdf1fab1bea1ef927897e8d69a6c50b4c8a1e29a54030dc686b6984abcfccdd",
  "chain": {
    "as_of": "ok_with_caveats",
    "latest": "refused"
  },
  "complete": true,
  "control": null,
  "drift": [
    {
      "ctx_id": "acdp://registry.example.com/aaaaaaaa-aaaa-4aaa-8aaa-aaaaaaaaaaaa",
      "kind": "revoked_after_as_of"
    },
    {
      "ctx_id": "acdp://registry.example.com/bbbbbbbb-bbbb-4bbb-8bbb-bbbbbbbbbbbb",
      "kind": "revoked_after_as_of"
    }
  ],
  "evidence_digest": "sha256:191d9fe83ba7b5543eae8647bc6ceb86a765b90d1e7d9b2471406b91755729b2",
  "frontier": [],
  "horizon": "2026-10-05T00:00:00.000Z",
  "limits": {
    "max_depth": 10,
    "max_fanout": 100,
    "max_nodes": 500
  },
  "nodes": [
    {
      "as_of": {
        "caveats": [
          "observed_basis"
        ],
        "stages": {
          "content_hash": {
            "basis": "self",
            "value": "ok"
          },
          "identity": {
            "basis": "registry",
            "value": "ok"
          },
          "key": {
            "basis": "observed",
            "evidence_time": "2026-09-30T00:00:00.000Z",
            "value": "current"
          },
          "key_revocation": {
            "basis": "observed",
            "evidence_time": "2026-09-30T00:00:00.000Z",
            "value": "not-revoked"
          },
          "log": {
            "value": "absent"
          },
          "presence": {
            "basis": "registry",
            "evidence_time": "2026-09-20T00:00:00.000Z",
            "value": "present"
          },
          "registry_receipt": {
            "basis": "registry",
            "evidence_time": "2026-09-20T00:00:00.000Z",
            "key_status": "current",
            "value": "ok"
          },
          "retraction": {
            "events_admitted": 0,
            "value": "not_retracted"
          },
          "signature": {
            "basis": "observed",
            "value": "ok"
          }
        },
        "verdict": "ok_with_caveats"
      },
      "ctx_id": "acdp://registry.example.com/aaaaaaaa-aaaa-4aaa-8aaa-aaaaaaaaaaaa",
      "depth": 0,
      "derived_from": [
        "acdp://registry.example.com/bbbbbbbb-bbbb-4bbb-8bbb-bbbbbbbbbbbb"
      ],
      "latest": {
        "caveats": [
          "observed_basis"
        ],
        "stages": {
          "content_hash": {
            "basis": "self",
            "value": "ok"
          },
          "identity": {
            "basis": "registry",
            "value": "ok"
          },
          "key": {
            "basis": "registry",
            "evidence_time": "2026-10-05T00:00:00.000Z",
            "value": "revoked"
          },
          "key_revocation": {
            "basis": "registry",
            "evidence_time": "2026-10-05T00:00:00.000Z",
            "revocation_ctx_id": "acdp://registry.example.com/eeeeeeee-eeee-4eee-8eee-eeeeeeeeeeee",
            "value": "revoked"
          },
          "log": {
            "value": "absent"
          },
          "presence": {
            "basis": "registry",
            "evidence_time": "2026-09-20T00:00:00.000Z",
            "value": "present"
          },
          "registry_receipt": {
            "basis": "registry",
            "evidence_time": "2026-09-20T00:00:00.000Z",
            "key_status": "current",
            "value": "ok"
          },
          "retraction": {
            "events_admitted": 0,
            "value": "not_retracted"
          },
          "signature": {
            "basis": "observed",
            "value": "ok"
          }
        },
        "verdict": "refused"
      }
    },
    {
      "as_of": {
        "caveats": [
          "observed_basis"
        ],
        "stages": {
          "content_hash": {
            "basis": "self",
            "value": "ok"
          },
          "identity": {
            "basis": "registry",
            "value": "ok"
          },
          "key": {
            "basis": "observed",
            "evidence_time": "2026-09-30T00:00:00.000Z",
            "value": "current"
          },
          "key_revocation": {
            "basis": "observed",
            "evidence_time": "2026-09-30T00:00:00.000Z",
            "value": "not-revoked"
          },
          "log": {
            "value": "absent"
          },
          "presence": {
            "basis": "registry",
            "evidence_time": "2026-09-10T00:00:00.000Z",
            "value": "present"
          },
          "registry_receipt": {
            "basis": "registry",
            "evidence_time": "2026-09-10T00:00:00.000Z",
            "key_status": "current",
            "value": "ok"
          },
          "retraction": {
            "events_admitted": 0,
            "value": "not_retracted"
          },
          "signature": {
            "basis": "observed",
            "value": "ok"
          }
        },
        "verdict": "ok_with_caveats"
      },
      "ctx_id": "acdp://registry.example.com/bbbbbbbb-bbbb-4bbb-8bbb-bbbbbbbbbbbb",
      "depth": 1,
      "derived_from": [],
      "latest": {
        "caveats": [
          "observed_basis"
        ],
        "stages": {
          "content_hash": {
            "basis": "self",
            "value": "ok"
          },
          "identity": {
            "basis": "registry",
            "value": "ok"
          },
          "key": {
            "basis": "registry",
            "evidence_time": "2026-10-05T00:00:00.000Z",
            "value": "revoked"
          },
          "key_revocation": {
            "basis": "registry",
            "evidence_time": "2026-10-05T00:00:00.000Z",
            "revocation_ctx_id": "acdp://registry.example.com/eeeeeeee-eeee-4eee-8eee-eeeeeeeeeeee",
            "value": "revoked"
          },
          "log": {
            "value": "absent"
          },
          "presence": {
            "basis": "registry",
            "evidence_time": "2026-09-10T00:00:00.000Z",
            "value": "present"
          },
          "registry_receipt": {
            "basis": "registry",
            "evidence_time": "2026-09-10T00:00:00.000Z",
            "key_status": "current",
            "value": "ok"
          },
          "retraction": {
            "events_admitted": 0,
            "value": "not_retracted"
          },
          "signature": {
            "basis": "observed",
            "value": "ok"
          }
        },
        "verdict": "refused"
      }
    }
  ],
  "options_digest": null,
  "require_attested_events": true,
  "roots": [
    "acdp://registry.example.com/aaaaaaaa-aaaa-4aaa-8aaa-aaaaaaaaaaaa"
  ],
  "tainted_paths": {
    "as_of": [],
    "latest": [
      [
        "acdp://registry.example.com/aaaaaaaa-aaaa-4aaa-8aaa-aaaaaaaaaaaa"
      ],
      [
        "acdp://registry.example.com/aaaaaaaa-aaaa-4aaa-8aaa-aaaaaaaaaaaa",
        "acdp://registry.example.com/bbbbbbbb-bbbb-4bbb-8bbb-bbbbbbbbbbbb"
      ]
    ]
  },
  "verdict_digest": "sha256:de0a19ac38cf74c0c7598214d3310b10b1ef1834d7db529e8ca8f97f8e59596e",
  "verdict_version": "acdp-chain-verdict/1"
}
