{
  "as_of": "2026-10-01T00:00:00.000Z",
  "as_of_digest": "sha256:552546ec839dd566646efa2b3bce302fdec6ec32dcadfeadd0c7fe46494c9bd5",
  "chain": {
    "as_of": "ok_with_caveats",
    "latest": "ok_with_caveats"
  },
  "complete": true,
  "control": null,
  "drift": [
    {
      "ctx_id": "acdp://registry.example.com/bbbbbbbb-bbbb-4bbb-8bbb-bbbbbbbbbbbb",
      "kind": "retracted_after_as_of"
    }
  ],
  "evidence_digest": "sha256:b826dbcf653feae8f6288739d90bc8949ab2fb7ff0611f8cbc9b890e4694d3c1",
  "frontier": [],
  "horizon": "2026-09-30T00:00:00.000Z",
  "limits": {
    "max_depth": 10,
    "max_fanout": 100,
    "max_nodes": 500
  },
  "nodes": [
    {
      "as_of": {
        "caveats": [
          "observed_basis"
        ],
        "stages": {
          "content_hash": {
            "basis": "self",
            "value": "ok"
          },
          "identity": {
            "basis": "registry",
            "value": "ok"
          },
          "key": {
            "basis": "self",
            "value": "current"
          },
          "key_revocation": {
            "basis": "observed",
            "evidence_time": "2026-09-30T00:00:00.000Z",
            "value": "not-revoked"
          },
          "log": {
            "value": "absent"
          },
          "presence": {
            "basis": "registry",
            "evidence_time": "2026-09-03T00:00:00.000Z",
            "value": "present"
          },
          "registry_receipt": {
            "basis": "registry",
            "evidence_time": "2026-09-03T00:00:00.000Z",
            "key_status": "current",
            "value": "ok"
          },
          "retraction": {
            "events_admitted": 0,
            "value": "not_retracted"
          },
          "signature": {
            "basis": "self",
            "value": "ok"
          }
        },
        "verdict": "ok_with_caveats"
      },
      "ctx_id": "acdp://registry.example.com/aaaaaaaa-aaaa-4aaa-8aaa-aaaaaaaaaaaa",
      "depth": 0,
      "derived_from": [
        "acdp://registry.example.com/bbbbbbbb-bbbb-4bbb-8bbb-bbbbbbbbbbbb"
      ],
      "latest": {
        "caveats": [
          "observed_basis"
        ],
        "stages": {
          "content_hash": {
            "basis": "self",
            "value": "ok"
          },
          "identity": {
            "basis": "registry",
            "value": "ok"
          },
          "key": {
            "basis": "self",
            "value": "current"
          },
          "key_revocation": {
            "basis": "observed",
            "evidence_time": "2026-09-30T00:00:00.000Z",
            "value": "not-revoked"
          },
          "log": {
            "value": "absent"
          },
          "presence": {
            "basis": "registry",
            "evidence_time": "2026-09-03T00:00:00.000Z",
            "value": "present"
          },
          "registry_receipt": {
            "basis": "registry",
            "evidence_time": "2026-09-03T00:00:00.000Z",
            "key_status": "current",
            "value": "ok"
          },
          "retraction": {
            "events_admitted": 0,
            "value": "not_retracted"
          },
          "signature": {
            "basis": "self",
            "value": "ok"
          }
        },
        "verdict": "ok_with_caveats"
      }
    },
    {
      "as_of": {
        "caveats": [
          "observed_basis"
        ],
        "stages": {
          "content_hash": {
            "basis": "self",
            "value": "ok"
          },
          "identity": {
            "basis": "registry",
            "value": "ok"
          },
          "key": {
            "basis": "self",
            "value": "current"
          },
          "key_revocation": {
            "basis": "observed",
            "evidence_time": "2026-09-30T00:00:00.000Z",
            "value": "not-revoked"
          },
          "log": {
            "value": "absent"
          },
          "presence": {
            "basis": "registry",
            "evidence_time": "2026-09-02T00:00:00.000Z",
            "value": "present"
          },
          "registry_receipt": {
            "basis": "registry",
            "evidence_time": "2026-09-02T00:00:00.000Z",
            "key_status": "current",
            "value": "ok"
          },
          "retraction": {
            "events_admitted": 0,
            "value": "not_retracted"
          },
          "signature": {
            "basis": "self",
            "value": "ok"
          }
        },
        "verdict": "ok_with_caveats"
      },
      "ctx_id": "acdp://registry.example.com/bbbbbbbb-bbbb-4bbb-8bbb-bbbbbbbbbbbb",
      "depth": 1,
      "derived_from": [],
      "latest": {
        "caveats": [
          "observed_basis",
          "retracted"
        ],
        "stages": {
          "content_hash": {
            "basis": "self",
            "value": "ok"
          },
          "identity": {
            "basis": "registry",
            "value": "ok"
          },
          "key": {
            "basis": "self",
            "value": "current"
          },
          "key_revocation": {
            "basis": "observed",
            "evidence_time": "2026-09-30T00:00:00.000Z",
            "value": "not-revoked"
          },
          "log": {
            "value": "absent"
          },
          "presence": {
            "basis": "registry",
            "evidence_time": "2026-09-02T00:00:00.000Z",
            "value": "present"
          },
          "registry_receipt": {
            "basis": "registry",
            "evidence_time": "2026-09-02T00:00:00.000Z",
            "key_status": "current",
            "value": "ok"
          },
          "retraction": {
            "basis": "observed",
            "events_admitted": 1,
            "value": "retracted"
          },
          "signature": {
            "basis": "self",
            "value": "ok"
          }
        },
        "verdict": "ok_with_caveats"
      }
    }
  ],
  "options_digest": null,
  "require_attested_events": true,
  "roots": [
    "acdp://registry.example.com/aaaaaaaa-aaaa-4aaa-8aaa-aaaaaaaaaaaa"
  ],
  "tainted_paths": {
    "as_of": [],
    "latest": [
      [
        "acdp://registry.example.com/aaaaaaaa-aaaa-4aaa-8aaa-aaaaaaaaaaaa",
        "acdp://registry.example.com/bbbbbbbb-bbbb-4bbb-8bbb-bbbbbbbbbbbb"
      ]
    ]
  },
  "verdict_digest": "sha256:40d0f5ca918bef68f5678a8d11c7be4aba4c8dda4981afc1a90d50f82daf25da",
  "verdict_version": "acdp-chain-verdict/1"
}
