{
  "as_of": null,
  "as_of_digest": null,
  "chain": {
    "as_of": null,
    "latest": "ok_with_caveats"
  },
  "complete": true,
  "control": null,
  "drift": [],
  "evidence_digest": "sha256:b4f630d33c752de3e7ded1c7b6ee47ef135629ad4073496c371dac219db1ee7a",
  "frontier": [],
  "horizon": "2026-10-10T00:00:00.000Z",
  "limits": {
    "max_depth": 10,
    "max_fanout": 100,
    "max_nodes": 500
  },
  "nodes": [
    {
      "as_of": null,
      "ctx_id": "acdp://registry.example.com/aaaaaaaa-aaaa-4aaa-8aaa-aaaaaaaaaaaa",
      "depth": 0,
      "derived_from": [],
      "latest": {
        "caveats": [
          "historical_key",
          "observed_basis"
        ],
        "stages": {
          "content_hash": {
            "basis": "self",
            "value": "ok"
          },
          "identity": {
            "basis": "registry",
            "value": "ok"
          },
          "key": {
            "basis": "observed",
            "evidence_time": "2026-10-10T00:00:00.000Z",
            "value": "historical_receipt_attested"
          },
          "key_revocation": {
            "basis": "observed",
            "evidence_time": "2026-09-30T00:00:00.000Z",
            "value": "not-revoked"
          },
          "log": {
            "value": "absent"
          },
          "presence": {
            "basis": "registry",
            "evidence_time": "2026-09-10T00:00:00.000Z",
            "value": "present"
          },
          "registry_receipt": {
            "basis": "registry",
            "evidence_time": "2026-09-10T00:00:00.000Z",
            "key_status": "current",
            "value": "ok"
          },
          "retraction": {
            "events_admitted": 0,
            "value": "not_retracted"
          },
          "signature": {
            "basis": "observed",
            "value": "ok"
          }
        },
        "verdict": "ok_with_caveats"
      }
    }
  ],
  "options_digest": null,
  "require_attested_events": true,
  "roots": [
    "acdp://registry.example.com/aaaaaaaa-aaaa-4aaa-8aaa-aaaaaaaaaaaa"
  ],
  "tainted_paths": {
    "as_of": null,
    "latest": []
  },
  "verdict_digest": "sha256:f5af0a1edeabd6b2284aa0e18ebc5a0158ce63e5ae07764e79e224928c40d196",
  "verdict_version": "acdp-chain-verdict/1"
}
