{
  "verdict_version": "acdp-chain-verdict/1",
  "roots": [
    "acdp://registry.example.com/aaaaaaaa-aaaa-4aaa-8aaa-aaaaaaaaaaaa"
  ],
  "as_of": "2026-10-01T00:00:00.000Z",
  "horizon": "2026-09-30T00:00:00.000Z",
  "limits": {
    "max_depth": 10,
    "max_nodes": 500,
    "max_fanout": 100
  },
  "require_attested_events": true,
  "options_digest": null,
  "evidence_digest": "sha256:6292e92a4ade153c5eb37a17059b9577691d8cf8fbb7100bdce65800da196910",
  "complete": true,
  "control": null,
  "frontier": [],
  "nodes": [
    {
      "ctx_id": "acdp://registry.example.com/aaaaaaaa-aaaa-4aaa-8aaa-aaaaaaaaaaaa",
      "depth": 0,
      "derived_from": [
        "acdp://registry.example.com/bbbbbbbb-bbbb-4bbb-8bbb-bbbbbbbbbbbb",
        "acdp://registry.example.com/cccccccc-cccc-4ccc-8ccc-cccccccccccc"
      ],
      "as_of": {
        "verdict": "ok_with_caveats",
        "caveats": [
          "observed_basis"
        ],
        "stages": {
          "presence": {
            "value": "present",
            "evidence_time": "2026-09-03T00:00:00.000Z",
            "basis": "registry"
          },
          "identity": {
            "value": "ok",
            "basis": "registry"
          },
          "content_hash": {
            "value": "ok",
            "basis": "self"
          },
          "signature": {
            "value": "ok",
            "basis": "self"
          },
          "registry_receipt": {
            "value": "ok",
            "key_status": "current",
            "basis": "registry",
            "evidence_time": "2026-09-03T00:00:00.000Z"
          },
          "key": {
            "value": "current",
            "basis": "self"
          },
          "log": {
            "value": "absent"
          },
          "retraction": {
            "value": "not_retracted",
            "events_admitted": 0
          },
          "key_revocation": {
            "value": "not-revoked",
            "basis": "observed",
            "evidence_time": "2026-09-30T00:00:00.000Z"
          }
        }
      },
      "latest": {
        "verdict": "ok_with_caveats",
        "caveats": [
          "observed_basis"
        ],
        "stages": {
          "presence": {
            "value": "present",
            "evidence_time": "2026-09-03T00:00:00.000Z",
            "basis": "registry"
          },
          "identity": {
            "value": "ok",
            "basis": "registry"
          },
          "content_hash": {
            "value": "ok",
            "basis": "self"
          },
          "signature": {
            "value": "ok",
            "basis": "self"
          },
          "registry_receipt": {
            "value": "ok",
            "key_status": "current",
            "basis": "registry",
            "evidence_time": "2026-09-03T00:00:00.000Z"
          },
          "key": {
            "value": "current",
            "basis": "self"
          },
          "log": {
            "value": "absent"
          },
          "retraction": {
            "value": "not_retracted",
            "events_admitted": 0
          },
          "key_revocation": {
            "value": "not-revoked",
            "basis": "observed",
            "evidence_time": "2026-09-30T00:00:00.000Z"
          }
        }
      }
    },
    {
      "ctx_id": "acdp://registry.example.com/bbbbbbbb-bbbb-4bbb-8bbb-bbbbbbbbbbbb",
      "depth": 1,
      "derived_from": [
        "acdp://registry.example.com/cccccccc-cccc-4ccc-8ccc-cccccccccccc"
      ],
      "as_of": {
        "verdict": "ok_with_caveats",
        "caveats": [
          "observed_basis"
        ],
        "stages": {
          "presence": {
            "value": "present",
            "evidence_time": "2026-09-02T00:00:00.000Z",
            "basis": "registry"
          },
          "identity": {
            "value": "ok",
            "basis": "registry"
          },
          "content_hash": {
            "value": "ok",
            "basis": "self"
          },
          "signature": {
            "value": "ok",
            "basis": "self"
          },
          "registry_receipt": {
            "value": "ok",
            "key_status": "current",
            "basis": "registry",
            "evidence_time": "2026-09-02T00:00:00.000Z"
          },
          "key": {
            "value": "current",
            "basis": "self"
          },
          "log": {
            "value": "absent"
          },
          "retraction": {
            "value": "not_retracted",
            "events_admitted": 0
          },
          "key_revocation": {
            "value": "not-revoked",
            "basis": "observed",
            "evidence_time": "2026-09-30T00:00:00.000Z"
          }
        }
      },
      "latest": {
        "verdict": "ok_with_caveats",
        "caveats": [
          "observed_basis"
        ],
        "stages": {
          "presence": {
            "value": "present",
            "evidence_time": "2026-09-02T00:00:00.000Z",
            "basis": "registry"
          },
          "identity": {
            "value": "ok",
            "basis": "registry"
          },
          "content_hash": {
            "value": "ok",
            "basis": "self"
          },
          "signature": {
            "value": "ok",
            "basis": "self"
          },
          "registry_receipt": {
            "value": "ok",
            "key_status": "current",
            "basis": "registry",
            "evidence_time": "2026-09-02T00:00:00.000Z"
          },
          "key": {
            "value": "current",
            "basis": "self"
          },
          "log": {
            "value": "absent"
          },
          "retraction": {
            "value": "not_retracted",
            "events_admitted": 0
          },
          "key_revocation": {
            "value": "not-revoked",
            "basis": "observed",
            "evidence_time": "2026-09-30T00:00:00.000Z"
          }
        }
      }
    },
    {
      "ctx_id": "acdp://registry.example.com/cccccccc-cccc-4ccc-8ccc-cccccccccccc",
      "depth": 1,
      "derived_from": [],
      "as_of": {
        "verdict": "ok_with_caveats",
        "caveats": [
          "observed_basis"
        ],
        "stages": {
          "presence": {
            "value": "present",
            "evidence_time": "2026-09-01T00:00:00.000Z",
            "basis": "registry"
          },
          "identity": {
            "value": "ok",
            "basis": "registry"
          },
          "content_hash": {
            "value": "ok",
            "basis": "self"
          },
          "signature": {
            "value": "ok",
            "basis": "self"
          },
          "registry_receipt": {
            "value": "ok",
            "key_status": "current",
            "basis": "registry",
            "evidence_time": "2026-09-01T00:00:00.000Z"
          },
          "key": {
            "value": "current",
            "basis": "self"
          },
          "log": {
            "value": "absent"
          },
          "retraction": {
            "value": "not_retracted",
            "events_admitted": 0
          },
          "key_revocation": {
            "value": "not-revoked",
            "basis": "observed",
            "evidence_time": "2026-09-30T00:00:00.000Z"
          }
        }
      },
      "latest": {
        "verdict": "ok_with_caveats",
        "caveats": [
          "observed_basis"
        ],
        "stages": {
          "presence": {
            "value": "present",
            "evidence_time": "2026-09-01T00:00:00.000Z",
            "basis": "registry"
          },
          "identity": {
            "value": "ok",
            "basis": "registry"
          },
          "content_hash": {
            "value": "ok",
            "basis": "self"
          },
          "signature": {
            "value": "ok",
            "basis": "self"
          },
          "registry_receipt": {
            "value": "ok",
            "key_status": "current",
            "basis": "registry",
            "evidence_time": "2026-09-01T00:00:00.000Z"
          },
          "key": {
            "value": "current",
            "basis": "self"
          },
          "log": {
            "value": "absent"
          },
          "retraction": {
            "value": "not_retracted",
            "events_admitted": 0
          },
          "key_revocation": {
            "value": "not-revoked",
            "basis": "observed",
            "evidence_time": "2026-09-30T00:00:00.000Z"
          }
        }
      }
    }
  ],
  "chain": {
    "as_of": "ok_with_caveats",
    "latest": "ok_with_caveats"
  },
  "tainted_paths": {
    "as_of": [],
    "latest": []
  },
  "drift": [],
  "as_of_digest": "sha256:4a2f39f374af85ee2676e8380619edb74fd96ba0664367ca9846f5a384eb3d80",
  "verdict_digest": "sha256:0d98321c741ff467f32af04014deccbb9e9eb32116a9332ff48092107e2c49f1"
}
